COMP,"The compilation of a unified list of computer viruses is made difficult because of naming."
COMP,"To aid the fight against computer viruses and other types of malicious software, many security advisory organizations and developers of anti-virus software compile and publish lists of viruses."
COMP,"When a new virus appears, the rush begins to identify and understand it as well as develop appropriate counter-measures to stop its propagation."
COMP,"Along the way, a name is attached to the virus."
COMP,"As the developers of anti-virus software compete partly based on how quickly they react to the new threat, they usually study and name the viruses independently."
COMP,"By the time the virus is identified, many names denote the same virus."
COMP,"Another source of ambiguity in names is that sometimes a virus initially identified as a completely new virus is found to be a variation of an earlier known virus, in which cases, it is often renamed."
COMP,"For example, the second variation of the Sobig worm was initially called "Palyh" but later renamed "Sobig.b"."
COMP,"Again, depending on how quickly this happens, the old name may persist."
COMP,"A computer virus is a program that spreads by first infecting files or the system areas of a computer or network router's hard drive and then making copies of itself."
COMP,"Some viruses are harmless, others may damage data files, and some may destroy files."
COMP,"Viruses used to be spread when people shared floppy disks and other portable media, now viruses are primarily spread through email messages."
COMP,"Unlike worms, viruses often require some sort of user action (e.g., opening an email attachment or visiting a malicious web page) to spread."
COMP,"A virus is simply a computer program--it can do anything that any other program you run on your computer can do."
COMP,"Some viruses are designed to deliberately damage files, and others may just spread to other computers."
COMP,"A worm is a type of virus that can spread without human interaction."
COMP,"Worms often spread from computer to computer and take up valuable memory and network bandwidth, which can cause a computer to stop responding."
COMP,"Worms can also allow attackers to gain access to your computer remotely."
COMP,"A Trojan horse is a computer program that is hiding a virus or other potentially damaging program."
COMP,"A Trojan horse can be a program that purports to do one action when, in fact, it is performing a malicious action on your computer."
COMP,"Trojan horses can be included in software that you download for free or as attachments in email messages."
COMP,"Most viruses, Trojan horses, and worms are activated when you open an attachment or click a link contained in an email message."
COMP,"If your email client allows scripting, then it is possible to get a virus by simply opening a message."
COMP,"It's best to limit what HTML is available in your email messages."
COMP,"The safest way to view email messages is in plain text."
COMP,"Most users get viruses from opening and running unknown email attachments."
COMP,"Never open anything that is attached to an email message unless you know the contents of the file."
COMP,"If you receive an attachment from a familiar email address, but were not expecting anything, you should contact the sender before opening the attachment."
COMP,"If you receive a message with an attachment and you do not recognize the sender, you should delete the message."
COMP,"Selecting the option to view your email messages in plain text, not HTML, will also help you to avoid a virus."
COMP,"Install anti-virus software from a reputable vendor."
COMP,"Update it and use it regularly."
COMP,"In addition to scanning for viruses on a regular basis, install an "on access" scanner (included in most anti-virus software packages) and configure it to start each time you start up your computer."
COMP,"This will protect your system by checking for viruses each time you run an executable file."
COMP,"Use a virus scan before you open any new programs or files that may contain executable code."
COMP,"This includes packaged software that you buy from the store as well as any program you might download from the Internet."
COMP,"If you are a member of an online community or chat room, be very careful about accepting files or clicking links that you find or that people send you within the community."
COMP,"Make sure you back up your data (documents, bookmark files, important email messages, etc.) on disc so that in the event of a virus infection, you do not lose valuable work."
COMP,"A computer virus is a type of malware that attaches to another program (like a document), which can replicate and spread after a person first runs it on their system."
COMP,"For instance, you could receive an email with a malicious attachment, open the file unknowingly, and then the computer virus runs on your computer."
COMP,"Viruses are harmful and can destroy data, slow down system resources, and log keystrokes."
COMP,"Cybercriminals aren’t creating new viruses all the time, instead they focus their efforts on more sophisticated and lucrative threats."
COMP,"When people talk about “getting a virus” on their computer, they usually mean some form of malware—it could be a virus, computer worm, Trojan, ransomware or some other harmful thing."
COMP,"Viruses and malware continue to evolve, and often cybercriminals use the type that gives them the best return at that particular time."
COMP,"The terms “virus” and “malware” are often used interchangeably, but they’re not the same thing."
COMP,"While a computer virus is a type of malware, not all malware are computer viruses."
COMP,"A computer virus works in much the same way:"
COMP,"A computer virus requires a host program."
COMP,"A computer virus requires user action to transmit from one system to another."
COMP,"A computer virus attaches bits of its own malicious code to other files or replaces files outright with copies of itself"
COMP,"It’s that second virus trait that tends to confuse people."
COMP,"Viruses can’t spread without some sort of action from a user, like opening up an infected Word document."
COMP,"Worms, on the other hand, are able to spread across systems and networks on their own, making them much more prevalent and dangerous."
COMP,"Famously, the 2017 WannaCry ransomware worm spread around the world, took down thousands of Windows systems, and raked in an appreciable amount of untraceable Bitcoin ransom payments for the alleged North Korean attackers."
COMP,"Computer viruses don’t typically capture headlines like that—at least not anymore."
COMP,"They are still a harmful type of malware, but they are not the only type of threat out there today, on your computer or mobile device."
COMP,"Many computer viruses target systems running Microsoft Windows."
COMP,"Macs, on the other hand, have enjoyed a reputation as virus-proof super machines, but in Apple’s own admission, Macs do get malware."
COMP,"There are more Windows users in the world than Mac users and cybercriminals simply choose to write viruses for the operating system (OS) with the largest amount of potential victims."
COMP,"Today, the “computer” in our pockets may be the one we use most often: our smartphones."
COMP,"Android and iOS are susceptible to various forms of malware, too."
COMP,"Fortunately, most cybersecurity companies like Malwarebytes offer protection for Windows, Mac, Android, and iOS today."
COMP,"Preventing computer viruses from infecting your computer starts with situational awareness."
COMP,"“Situational awareness is something law enforcement and militaries have practiced for decades. It refers to a police officer or a soldier’s ability to perceive threats and make the best decision possible in a potentially stressful situation,” said Malwarebytes Head of Security, John Donovan."
COMP,"“As it applies to cybersecurity, situational awareness is your first line of defense against cyberthreats. By staying on the lookout for phishing attacks and avoiding suspicious links and attachments, consumers can largely avoid most malware threats.”"
COMP,"Regarding email attachments and embedded links, even if the sender is someone you know: viruses have been known to hijack Outlook contact lists on infected computers and send virus laden attachments to friends, family and coworkers, the Melissa virus being a perfect example."
COMP,"If an email reads oddly, it’s probably a phishing scam or malspam."
COMP,"When in doubt about the authenticity of an email, don’t be afraid to reach out to the sender."
COMP,"A simple call or text message can save you a lot of trouble."
COMP,"Next, invest in good cybersecurity software."
COMP,"We’ve made a distinction between computer viruses and malware, which now begs the question, “Do I need antivirus software or anti-malware software?”"
COMP,"We’ve covered this topic before in great detail so checkout our article on antivirus vs. anti-malware."
COMP,"For now, though, here’s a quick gloss on the subject."
COMP,"Antivirus (AV) refers to early forms of cybersecurity software focused on stopping computer viruses."
COMP,"Just viruses."
COMP,"Anti-malware refers to all-encompassing threat protection designed to stop old-fashioned viruses as well as today’s malware threats."
COMP,"Given a choice between traditional AV with limited threat detection technology and modern anti-malware with all the bells and whistles, invest in anti-malware and rest easy at night."
COMP,"As mentioned previously in this piece, traditional AV solutions rely on signature-based detection."
COMP,"AV scans your computer and compares each and every file against a database of known viruses that functions a lot like a criminal database."
COMP,"If there’s a signature match, the malicious file is thrown into virus jail before it can cause any damage."
COMP,"The problem with signature-based detection is that it can’t stop what’s known as a zero-day virus; that is, a virus that cybersecurity researchers have never seen before and for which there is no criminal profile."
COMP,"Until the zero-day virus is added to the database, traditional AV can’t detect it."
COMP,"Malwarebytes’ Multi-Vector Protection, conversely, combines several forms of threat detection technology into one malware crushing machine."
COMP,"Amongst these many layers of protection, Malwarebytes uses what’s called heuristic analysis to look for telltale malicious behavior from any given program."
COMP,"If it looks like a virus and behaves like a virus, then it’s probably a virus."
COMP,"Use a VPN to protect your privacy online, especially when you’re on the public Wi-Fi network."
COMP,"A VPN app hides your IP address and tunnels your traffic through a secure connection."
COMP,"Read more about VPN here – What is VPN."
NON,"Socialism is an economic and political philosophy encompassing diverse economic and social systems characterised by social ownership of the means of production, as opposed to private ownership."
NON,"It describes the economic, political, and social theories and movements associated with the implementation of such systems."
NON,"Social ownership can take various forms, including public, community, collective, cooperative, or employee."
NON,"Traditionally, socialism is on the left wing of the political spectrum."
NON,"Types of socialism vary based on the role of markets and planning in resource allocation, and the structure of management in organizations."
NON,"Socialist systems divide into non-market and market forms."
NON,"A non-market socialist system seeks to eliminate the perceived inefficiencies, irrationalities, unpredictability, and crises that socialists traditionally associate with capital accumulation and the profit system."
NON,"Market socialism retains the use of monetary prices, factor markets and sometimes the profit motive."
NON,"Socialist parties and ideas remain a political force with varying degrees of power and influence, heading national governments in several countries."
NON,"Socialist politics have been internationalist and nationalist; organised through political parties and opposed to party politics; at times overlapping with trade unions and other times independent and critical of them, and present in industrialised and developing nations."
NON,"Social democracy originated within the socialist movement, supporting economic and social interventions to promote social justice."
NON,"While retaining socialism as a long-term goal, in the post-war period social democracy embraced a mixed economy based on Keynesianism within a predominantly developed capitalist market economy and liberal democratic polity that expands state intervention to include income redistribution, regulation, and a welfare state."
NON,"The socialist political movement includes political philosophies that originated in the revolutionary movements of the mid-to-late 18th century and out of concern for the social problems that socialists associated with capitalism."
NON,"By the late 19th century, after the work of Karl Marx and his collaborator Friedrich Engels, socialism had come to signify anti-capitalism and advocacy for a post-capitalist system based on some form of social ownership of the means of production."
NON,"By the early 1920s, communism and social democracy had become the two dominant political tendencies within the international socialist movement, with socialism itself becoming the most influential secular movement of the 20th century."
NON,"Many socialists also adopted the causes of other social movements, such as feminism, environmentalism, and progressivism."
NON,"While the emergence of the Soviet Union as the world's first nominally socialist state led to socialism's widespread association with the Soviet economic model, several scholars state that in practice, the model functioned as a form of state capitalism."
NON,"Academics have noted some Western European countries have been governed by socialist parties or have mixed economies that are sometimes called "democratic socialist"."
NON,"Following the revolutions of 1989, many of these countries moved away from socialism as a neoliberal consensus replaced the social democratic consensus in the advanced capitalist world, while many former socialist politicians and political parties embraced "Third Way" politics, remaining committed to equality and welfare, while abandoning public ownership and class-based politics."
NON,"Socialism experienced a resurgence in popularity in the 2010s, most prominently in the form of democratic socialism."
NON,"A rocket engine uses stored rocket propellants as the reaction mass for forming a high-speed propulsive jet of fluid, usually high-temperature gas."
NON,"Rocket engines are reaction engines, producing thrust by ejecting mass rearward, in accordance with Newton's third law."
NON,"Most rocket engines use the combustion of reactive chemicals to supply the necessary energy, but non-combusting forms such as cold gas thrusters and nuclear thermal rockets also exist."
NON,"Vehicles propelled by rocket engines are commonly used by ballistic missiles (they normally use solid fuel) and rockets."
NON,"Rocket vehicles carry their own oxidiser, unlike most combustion engines, so rocket engines can be used in a vacuum to propel spacecraft and ballistic missiles."
NON,"Compared to other types of jet engine, rocket engines are the lightest and have the highest thrust, but are the least propellant-efficient (they have the lowest specific impulse)."
NON,"The ideal exhaust is hydrogen, the lightest of all elements, but chemical rockets produce a mix of heavier species, reducing the exhaust velocity."
NON,"Rocket engines become more efficient at high speeds, due to the Oberth effect."
NON,"A soft drink (see § Terminology for other names) is any water-based flavored drink, usually but not necessarily carbonated, and typically including added sweetener."
NON,"Flavors used can be natural or artificial."
NON,"The sweetener may be a sugar, high-fructose corn syrup, fruit juice, a sugar substitute (in the case of diet sodas), or some combination of these."
NON,"Soft drinks may also contain caffeine, colorings, preservatives and other ingredients."
NON,"Soft drinks are called "soft" in contrast with "hard" alcoholic drinks."
NON,"Small amounts of alcohol may be present in a soft drink, but the alcohol content must be less than 0.5% of the total volume of the drink in many countries and localities if the drink is to be considered non-alcoholic."
NON,"Types of soft drinks include lemon-lime drinks, orange soda, cola, grape soda, cream soda, ginger ale and root beer."
NON,"Soft drinks may be served cold, over ice cubes, or at room temperature."
NON,"They are available in many container formats, including cans, glass bottles, and plastic bottles."
NON,"Containers come in a variety of sizes, ranging from small bottles to large multi-liter containers."
NON,"Soft drinks are widely available at fast food restaurants, movie theaters, convenience stores, casual-dining restaurants, dedicated soda stores, vending machines and bars from soda fountain machines."
NON,"Within a decade of the invention of carbonated water by Joseph Priestley in 1767, inventors in Britain and in Europe had used his concept to produce the drink in greater quantities."
NON,"One such inventor, J. J. Schweppe, formed Schweppes in 1783 and began selling the world's first bottled soft drink."
NON,"Soft drink brands founded in the 19th century include R. White's Lemonade in 1845, Dr Pepper in 1885 and Coca-Cola in 1886."
NON,"Subsequent brands include Pepsi, Irn-Bru, Sprite, Fanta, 7 Up and RC Cola."
NON,"Beer is an alcoholic drink produced by the brewing and fermentation of starches from cereal grains—most commonly malted barley, although wheat, maize (corn), rice, and oats are also used."
NON,"The fermentation of the starch sugars in the wort produces ethanol and carbonation."
NON,"Most beer is brewed with hops, which add bitterness and act as a preservative and stabilising agent."
NON,"Other flavouring agents, such as gruit, herbs, or fruits, may also be used."
NON,"In commercial brewing, natural carbonation is often replaced with forced carbonation."
NON,"Some of the earliest writings refer to the production and distribution of beer: the Code of Hammurabi included laws regulating it, and "The Hymn to Ninkasi", a prayer to the Mesopotamian goddess of beer, a recipe for it."
NON,"Beer is distributed in bottles and cans and is also commonly available on draught, particularly in pubs and bars."
NON,"The brewing industry is a global business, consisting of several dominant multinational companies and many thousands of smaller producers ranging from brewpubs to regional breweries."
NON,"The strength of beer is usually around 4% to 6% alcohol by volume (ABV)."
NON,"Beer forms part of the culture of many nations and is associated with social traditions such as beer festivals, as well as activities like pub crawling, pub quizzes, and pub games."
NON,"Calculus is the mathematical study of continuous change, in the same way that geometry is the study of shape, and algebra is the study of generalizations of arithmetic operations."
NON,"Originally called infinitesimal calculus or "the calculus of infinitesimals", it has two major branches, differential calculus and integral calculus."
NON,"The former concerns instantaneous rates of change, and the slopes of curves, while the latter concerns accumulation of quantities, and areas under or between curves."
NON,"These two branches are related to each other by the fundamental theorem of calculus, and they make use of the fundamental notions of convergence of infinite sequences and infinite series to a well-defined limit."
NON,"Infinitesimal calculus was developed independently in the late 17th century by Isaac Newton and Gottfried Wilhelm Leibniz."
NON,"Later work, including codifying the idea of limits, put these developments on a more solid conceptual footing."
NON,"Today, calculus has widespread uses in science, engineering, and social science."
NON,"Pythagoras of Samos (Ancient Greek: Πυθαγόρας ὁ Σάμιος, romanized: Pythagóras ho Sámios, lit. 'Pythagoras the Samian', or simply Πυθαγόρας; Πυθαγόρης in Ionian Greek; c. 570 – c. 495 BC) was an ancient Ionian Greek philosopher, polymath and the eponymous founder of Pythagoreanism."
NON,"His political and religious teachings were well known in Magna Graecia and influenced the philosophies of Plato, Aristotle, and, through them, the West in general."
NON,"Knowledge of his life is clouded by legend."
NON,"Modern scholars disagree regarding Pythagoras's education and influences, but they do agree that, around 530 BC, he travelled to Croton in southern Italy, where he founded a school in which initiates were sworn to secrecy and lived a communal, ascetic lifestyle."
NON,"This lifestyle entailed a number of dietary prohibitions, traditionally said to have included aspects of vegetarianism."
NON,"The teaching most securely identified with Pythagoras is metempsychosis, or the "transmigration of souls", which holds that every soul is immortal and, upon death, enters into a new body."
NON,"He may have also devised the doctrine of musica universalis, which holds that the planets move according to mathematical equations and thus resonate to produce an inaudible symphony of music."
NON,"Scholars debate whether Pythagoras developed the numerological and musical teachings attributed to him, or if those teachings were developed by his later followers, particularly Philolaus of Croton."
NON,"Following Croton's decisive victory over Sybaris in around 510 BC, Pythagoras's followers came into conflict with supporters of democracy, and Pythagorean meeting houses were burned."
NON,"Pythagoras may have been killed during this persecution, or he may have escaped to Metapontum and died there."
NON,"In antiquity, Pythagoras was credited with many mathematical and scientific discoveries, including the Pythagorean theorem, Pythagorean tuning, the five regular solids, the Theory of Proportions, the sphericity of the Earth, and the identity of the morning and evening stars as the planet Venus."
NON,"It was said that he was the first man to call himself a philosopher ("lover of wisdom") and that he was the first to divide the globe into five climatic zones."
NON,"Classical historians debate whether Pythagoras made these discoveries, and many of the accomplishments credited to him likely originated earlier or were made by his colleagues or successors."
NON,"Some accounts mention that the philosophy associated with Pythagoras was related to mathematics and that numbers were important, but it is debated to what extent, if at all, he actually contributed to mathematics or natural philosophy."
NON,"Pythagoras influenced Plato, whose dialogues, especially his Timaeus, exhibit Pythagorean teachings."
NON,"Pythagorean ideas on mathematical perfection also impacted ancient Greek art."
NON,"His teachings underwent a major revival in the first century BC among Middle Platonists, coinciding with the rise of Neopythagoreanism."
NON,"Pythagoras continued to be regarded as a great philosopher throughout the Middle Ages and his philosophy had a major impact on scientists such as Nicolaus Copernicus, Johannes Kepler, and Isaac Newton."
NON,"Pythagorean symbolism was used throughout early modern European esotericism, and his teachings as portrayed in Ovid's Metamorphoses influenced the modern vegetarian movement."
NON,"China (Chinese: 中国; pinyin: Zhōngguó), officially the People's Republic of China (PRC), is a country in East Asia."
NON,"With a population exceeding 1.4 billion, it is the world's second-most-populous country."
NON,"China spans the equivalent of five time zones and borders fourteen countries by land."
NON,"With an area of nearly 9.6 million square kilometers (3,700,000 sq mi), it is the third-largest country by total land area."
NON,"The country is divided into 33 province-level divisions, inclusive of 22 provinces, five autonomous regions, four municipalities, and two semi-autonomous special administrative regions."
NON,"Beijing is the national capital, while Shanghai is its most populous city and largest financial center."
NON,"The region has been inhabited since the Paleolithic era."
NON,"Early Chinese dynasties, such as the Xia, Shang and the Zhou, emerged in the basin of the Yellow River before the late second millennium BCE."
NON,"The eighth to third centuries BCE saw a breakdown in Zhou authority and significant conflicts, as well as the emergence of literature, philosophy, and historiography."
NON,"In 221 BCE, China was unified under an emperor for the first time."
NON,"Appointed non-hereditary officials began ruling counties instead of the aristocracy, ushering in more than two millennia of imperial dynasties including the Qin, Han, Tang, Yuan, Ming, and Qing."
NON,"With the invention of gunpowder and paper, the establishment of the Silk Road, and the building of the Great Wall, Chinese culture—including languages, traditions, architecture, philosophy and technology—flourished and has heavily influenced East Asia and beyond."
NON,"After decades of struggle, the monarchy was overthrown in 1912 and the Republic of China (ROC) was established."
NON,"Despite China's eventual victory in the Second Sino-Japanese War and the Pacific War in general, numerous atrocities such as the Nanjing Massacre left lasting effects on the country."
NON,"Concurrently during this period, the Chinese Communist Party (CCP) and the Kuomintang (KMT) government were fighting sporadically since 1927, with a brief truce as a united front when Japan began invading the country."
