BIO,"Other antiviral drugs target different stages of the viral life cycle."
BIO,"HIV is dependent on an enzyme called the HIV-1 protease for the virus to become infectious."
BIO,"There is a class of drugs called protease inhibitors, which bind to this enzyme and stop it from functioning."
BIO,"Hepatitis C is caused by an RNA virus."
BIO,"In 80% of those infected, the disease becomes chronic, and they remain infectious for the rest of their lives unless they are treated."
BIO,"There are effective treatments that use direct-acting antivirals."
BIO,"Treatments for chronic carriers of the hepatitis B virus have been developed by a similar strategy, using lamivudine and other anti-viral drugs."
BIO,"In both diseases, the drugs stop the virus from reproducing and the interferon kills any remaining infected cells."
BIO,"HIV infections are usually treated with a combination of antiviral drugs, each targeting a different stage in the virus's life cycle."
BIO,"There are drugs that prevent the virus from attaching to cells, others that are nucleoside analogues and some poison the virus's enzymes that it needs to reproduce."
BIO,"The success of these drugs is proof of the importance of knowing how viruses reproduce."
BIO,"Viruses are the most abundant biological entity in aquatic environments; one teaspoon of seawater contains about ten million viruses, and they are essential to the regulation of saltwater and freshwater ecosystems."
BIO,"Most are bacteriophages, which are harmless to plants and animals."
BIO,"They infect and destroy the bacteria in aquatic microbial communities and this is the most important mechanism of recycling carbon in the marine environment."
BIO,"The organic molecules released from the bacterial cells by the viruses stimulate fresh bacterial and algal growth."
BIO,"Microorganisms constitute more than 90% of the biomass in the sea."
BIO,"It is estimated that viruses kill approximately 20% of this biomass each day and that there are fifteen times as many viruses in the oceans as there are bacteria and archaea."
BIO,"They are mainly responsible for the rapid destruction of harmful algal blooms, which often kill other marine life."
BIO,"The number of viruses in the oceans decreases further offshore and deeper into the water, where there are fewer host organisms."
BIO,"Their effects are far-reaching; by increasing the amount of respiration in the oceans, viruses are indirectly responsible for reducing the amount of carbon dioxide in the atmosphere by approximately 3 gigatonnes of carbon per year."
BIO,"Marine mammals are also susceptible to viral infections."
BIO,"In 1988 and 2002, thousands of harbour seals were killed in Europe by phocine distemper virus."
BIO,"Many other viruses, including caliciviruses, herpesviruses, adenoviruses and parvoviruses, circulate in marine mammal populations."
BIO,"Viruses can also serve as an alternative food source for microorganisms which engage in virovory, supplying nucleic acids, nitrogen, and phosphorus through their consumption."
BIO,"A virus is a submicroscopic infectious agent that replicates only inside the living cells of an organism."
BIO,"Viruses infect all life forms, from animals and plants to microorganisms, including bacteria and archaea."
BIO,"Viruses are found in almost every ecosystem on Earth and are the most numerous type of biological entity."
BIO,"Since Dmitri Ivanovsky's 1892 article describing a non-bacterial pathogen infecting tobacco plants and the discovery of the tobacco mosaic virus by Martinus Beijerinck in 1898, more than 11,000 of the millions of virus species have been described in detail."
BIO,"The study of viruses is known as virology, a subspeciality of microbiology."
BIO,"When infected, a host cell is often forced to rapidly produce thousands of copies of the original virus."
BIO,"When not inside an infected cell or in the process of infecting a cell, viruses exist in the form of independent viral particles, or virions, consisting of"
BIO,"(i) genetic material, i.e., long molecules of DNA or RNA that encode the structure of the proteins by which the virus acts;"
BIO,"(ii) a protein coat, the capsid, which surrounds and protects the genetic material; and in some cases"
BIO,"(iii) an outside envelope of lipids."
BIO,"The shapes of these virus particles range from simple helical and icosahedral forms to more complex structures."
BIO,"Most virus species have virions too small to be seen with an optical microscope and are one-hundredth the size of most bacteria."
BIO,"The origins of viruses in the evolutionary history of life are still unclear."
BIO,"Some viruses may have evolved from plasmids, which are pieces of DNA that can move between cells."
BIO,"Other viruses may have evolved from bacteria."
BIO,"In evolution, viruses are an important means of horizontal gene transfer, which increases genetic diversity in a way analogous to sexual reproduction."
BIO,"Viruses are considered by some biologists to be a life form, because they carry genetic material, reproduce, and evolve through natural selection, although they lack the key characteristics, such as cell structure, that are generally considered necessary criteria for defining life."
BIO,"Because they possess some but not all such qualities, viruses have been described as "organisms at the edge of life" and as replicators."
BIO,"Viruses spread in many ways."
BIO,"One transmission pathway is through disease-bearing organisms known as vectors: for example, viruses are often transmitted from plant to plant by insects that feed on plant sap, such as aphids; and viruses in animals can be carried by blood-sucking insects."
BIO,"Many viruses spread in the air by coughing and sneezing, including influenza viruses, SARS-CoV-2, chickenpox, smallpox, and measles."
BIO,"Norovirus and rotavirus, common causes of viral gastroenteritis, are transmitted by the faecal–oral route, passed by hand-to-mouth contact or in food or water."
BIO,"The infectious dose of norovirus required to produce infection in humans is fewer than 100 particles."
BIO,"HIV is one of several viruses transmitted through sexual contact and by exposure to infected blood."
BIO,"The variety of host cells that a virus can infect is called its host range: this is narrow for viruses specialized to infect only a few species, or broad for viruses capable of infecting many."
BIO,"Viral infections in animals provoke an immune response that usually eliminates the infecting virus."
BIO,"Immune responses can also be produced by vaccines, which confer an artificially acquired immunity to the specific viral infection."
BIO,"Some viruses, including those that cause HIV/AIDS, HPV infection, and viral hepatitis, evade these immune responses and result in chronic infections."
BIO,"Several classes of antiviral drugs have been developed."
BIO,"Viruses are found wherever there is life and have probably existed since living cells first evolved."
BIO,"The origin of viruses is unclear because they do not form fossils, so molecular techniques are used to infer how they arose."
BIO,"In addition, viral genetic material occasionally integrates into the germline of the host organisms, by which they can be passed on vertically to the offspring of the host for many generations."
BIO,"This provides an invaluable source of information for paleovirologists to trace back ancient viruses that existed as far back as millions of years ago."
BIO,"There are three main hypotheses that aim to explain the origins of viruses:"
BIO,"Viruses may have once been small cells that parasitised larger cells."
BIO,"Over time, genes not required by their parasitism were lost."
BIO,"The bacteria rickettsia and chlamydia are living cells that, like viruses, can reproduce only inside host cells."
BIO,"They lend support to this hypothesis, as their dependence on parasitism is likely to have caused the loss of genes that enabled them to survive outside a cell."
BIO,"This is also called the 'degeneracy hypothesis', or 'reduction hypothesis'."
BIO,"Some viruses may have evolved from bits of DNA or RNA that "escaped" from the genes of a larger organism."
BIO,"The escaped DNA could have come from plasmids (pieces of naked DNA that can move between cells) or transposons (molecules of DNA that replicate and move around to different positions within the genes of the cell)."
BIO,"Once called jumping genes, transposons are examples of mobile genetic elements and could be the origin of some viruses."
BIO,"They were discovered in maize by Barbara McClintock in 1950."
BIO,"This is sometimes called the 'vagrancy hypothesis', or the 'escape hypothesis'."
BIO,"This is also called the 'virus-first hypothesis' and proposes that viruses may have evolved from complex molecules of protein and nucleic acid at the same time that cells first appeared on Earth and would have been dependent on cellular life for billions of years."
BIO,"Viroids are molecules of RNA that are not classified as viruses because they lack a protein coat."
BIO,"They have characteristics that are common to several viruses and are often called subviral agents."
BIO,"Viroids are important pathogens of plants."
BIO,"They do not code for proteins but interact with the host cell and use the host machinery for their replication."
BIO,"The hepatitis delta virus of humans has an RNA genome similar to viroids but has a protein coat derived from hepatitis B virus and cannot produce one of its own."
BIO,"It is, therefore, a defective virus."
BIO,"Although hepatitis delta virus genome may replicate independently once inside a host cell, it requires the help of hepatitis B virus to provide a protein coat so that it can be transmitted to new cells."
BIO,"In similar manner, the sputnik virophage is dependent on mimivirus, which infects the protozoan Acanthamoeba castellanii."
BIO,"These viruses, which are dependent on the presence of other virus species in the host cell, are called 'satellites' and may represent evolutionary intermediates of viroids and viruses."
BIO,"In the past, there were problems with all of these hypotheses: the regressive hypothesis did not explain why even the smallest of cellular parasites do not resemble viruses in any way."
BIO,"The escape hypothesis did not explain the complex capsids and other structures on virus particles."
BIO,"The virus-first hypothesis contravened the definition of viruses in that they require host cells."
BIO,"Viruses are now recognised as ancient and as having origins that pre-date the divergence of life into the three domains."
BIO,"This discovery has led modern virologists to reconsider and re-evaluate these three classical hypotheses."
BIO,"The evidence for an ancestral world of RNA cells and computer analysis of viral and host DNA sequences give a better understanding of the evolutionary relationships between different viruses and may help identify the ancestors of modern viruses."
BIO,"To date, such analyses have not proved which of these hypotheses is correct."
BIO,"It seems unlikely that all currently known viruses have a common ancestor, and viruses have probably arisen numerous times in the past by one or more mechanisms."
BIO,"Scientific opinions differ on whether viruses are a form of life or organic structures that interact with living organisms."
BIO,"They have been described as "organisms at the edge of life", since they resemble organisms in that they possess genes, evolve by natural selection, and reproduce by creating multiple copies of themselves through self-assembly."
BIO,"Although they have genes, they do not have a cellular structure, which is often seen as the basic unit of life."
BIO,"Viruses do not have their own metabolism and require a host cell to make new products."
BIO,"They therefore cannot naturally reproduce outside a host cell—although some bacteria such as rickettsia and chlamydia are considered living organisms despite the same limitation."
BIO,"Accepted forms of life use cell division to reproduce, whereas viruses spontaneously assemble within cells."
BIO,"They differ from autonomous growth of crystals as they inherit genetic mutations while being subject to natural selection."
BIO,"Virus self-assembly within host cells has implications for the study of the origin of life, as it lends further credence to the hypothesis that life could have started as self-assembling organic molecules."
BIO,"Viruses display a wide diversity of sizes and shapes, called 'morphologies'."
BIO,"In general, viruses are much smaller than bacteria and more than a thousand bacteriophage viruses would fit inside an Escherichia coli bacterium's cell."
BIO,"Many viruses that have been studied are spherical and have a diameter between 20 and 300 nanometres."
BIO,"Some filoviruses, which are filaments, have a total length of up to 1400 nm; their diameters are only about 80 nm."
BIO,"Most viruses cannot be seen with an optical microscope, so scanning and transmission electron microscopes are used to visualise them."
BIO,"To increase the contrast between viruses and the background, electron-dense "stains" are used."
BIO,"These are solutions of salts of heavy metals, such as tungsten, that scatter the electrons from regions covered with the stain."
BIO,"When virions are coated with stain (positive staining), fine detail is obscured."
BIO,"Negative staining overcomes this problem by staining the background only."
BIO,"A complete virus particle, known as a virion, consists of nucleic acid surrounded by a protective coat of protein called a capsid."
BIO,"These are formed from protein subunits called capsomeres."
BIO,"Viruses can have a lipid "envelope" derived from the host cell membrane."
BIO,"The capsid is made from proteins encoded by the viral genome and its shape serves as the basis for morphological distinction."
BIO,"Virally-coded protein subunits will self-assemble to form a capsid, in general requiring the presence of the virus genome."
BIO,"Complex viruses code for proteins that assist in the construction of their capsid."
BIO,"Proteins associated with nucleic acid are known as nucleoproteins, and the association of viral capsid proteins with viral nucleic acid is called a nucleocapsid."
BIO,"The capsid and entire virus structure can be mechanically (physically) probed through atomic force microscopy."
BIO,"In general, there are five main morphological virus types."
BIO,"These viruses are composed of a single type of capsomere stacked around a central axis to form a helical structure, which may have a central cavity, or tube."
BIO,"This arrangement results in virions which can be short and highly rigid rods, or long and very flexible filaments."
BIO,"The genetic material (typically single-stranded RNA, but single-stranded DNA in some cases) is bound into the protein helix by interactions between the negatively charged nucleic acid and positive charges on the protein."
BIO,"Overall, the length of a helical capsid is related to the length of the nucleic acid contained within it, and the diameter is dependent on the size and arrangement of capsomeres."
BIO,"The well-studied tobacco mosaic virus and inovirus are examples of helical viruses."
BIO,"Most animal viruses are icosahedral or near-spherical with chiral icosahedral symmetry."
BIO,"A regular icosahedron is the optimum way of forming a closed shell from identical subunits."
BIO,"The minimum number of capsomeres required for each triangular face is 3, which gives 60 for the icosahedron."
BIO,"Many viruses, such as rotavirus, have more than 60 capsomers and appear spherical but they retain this symmetry."
BIO,"To achieve this, the capsomeres at the apices are surrounded by five other capsomeres and are called pentons."
BIO,"Capsomeres on the triangular faces are surrounded by six others and are called hexons."
BIO,"Hexons are in essence flat and pentons, which form the 12 vertices, are curved."
BIO,"The same protein may act as the subunit of both the pentamers and hexamers or they may be composed of different proteins."
BIO,"This is an icosahedron elongated along the fivefold axis and is a common arrangement of the heads of bacteriophages."
BIO,"This structure is composed of a cylinder with a cap at either end."
BIO,"Some species of virus envelop themselves in a modified form of one of the cell membranes, either the outer membrane surrounding an infected host cell or internal membranes such as a nuclear membrane or endoplasmic reticulum, thus gaining an outer lipid bilayer known as a viral envelope."
BIO,"This membrane is studded with proteins coded for by the viral genome and host genome; the lipid membrane itself and any carbohydrates present originate entirely from the host."
BIO,"Influenza virus, HIV (which causes AIDS), and severe acute respiratory syndrome coronavirus 2 (which causes COVID-19) use this strategy."
BIO,"Most enveloped viruses are dependent on the envelope for their infectivity."
BIO,"These viruses possess a capsid that is neither purely helical nor purely icosahedral, and that may possess extra structures such as protein tails or a complex outer wall."
BIO,"Some bacteriophages, such as Enterobacteria phage T4, have a complex structure consisting of an icosahedral head bound to a helical tail, which may have a hexagonal base plate with protruding protein tail fibres."
BIO,"This tail structure acts like a molecular syringe, attaching to the bacterial host and then injecting the viral genome into the cell."
BIO,"The poxviruses are large, complex viruses that have an unusual morphology."
BIO,"The viral genome is associated with proteins within a central disc structure known as a nucleoid."
BIO,"The nucleoid is surrounded by a membrane and two lateral bodies of unknown function."
BIO,"The virus has an outer envelope with a thick layer of protein studded over its surface."
BIO,"The whole virion is slightly pleomorphic, ranging from ovoid to brick-shaped."
BIO,"Mimivirus is one of the largest characterised viruses, with a capsid diameter of 400 nm."
BIO,"Protein filaments measuring 100 nm project from the surface."
BIO,"The capsid appears hexagonal under an electron microscope, therefore the capsid is probably icosahedral."
BIO,"In 2011, researchers discovered the largest then known virus in samples of water collected from the ocean floor off the coast of Las Cruces, Chile."
BIO,"Provisionally named Megavirus chilensis, it can be seen with a basic optical microscope."
BIO,"In 2013, the Pandoravirus genus was discovered in Chile and Australia, and has genomes about twice as large as Megavirus and Mimivirus."
BIO,"All giant viruses have dsDNA genomes and they are classified into several families: Mimiviridae, Pithoviridae, Pandoraviridae, Phycodnaviridae, and the Mollivirus genus."
BIO,"Some viruses that infect Archaea have complex structures unrelated to any other form of virus, with a wide variety of unusual shapes, ranging from spindle-shaped structures to viruses that resemble hooked rods, teardrops or even bottles."
BIO,"Other archaeal viruses resemble the tailed bacteriophages, and can have multiple tail structures."
BIO,"An enormous variety of genomic structures can be seen among viral species; as a group, they contain more structural genomic diversity than plants, animals, archaea, or bacteria."
BIO,"There are millions of different types of viruses, although fewer than 7,000 types have been described in detail."
BIO,"As of January 2021, the NCBI Virus genome database has more than 193,000 complete genome sequences, but there are doubtlessly many more to be discovered."
BIO,"A virus has either a DNA or an RNA genome and is called a DNA virus or an RNA virus, respectively."
BIO,"The vast majority of viruses have RNA genomes."
BIO,"Plant viruses tend to have single-stranded RNA genomes and bacteriophages tend to have double-stranded DNA genomes."
BIO,"Viral genomes are circular, as in the polyomaviruses, or linear, as in the adenoviruses."
BIO,"The type of nucleic acid is irrelevant to the shape of the genome."
BIO,"Among RNA viruses and certain DNA viruses, the genome is often divided into separate parts, in which case it is called segmented."
BIO,"For RNA viruses, each segment often codes for only one protein and they are usually found together in one capsid."
BIO,"All segments are not required to be in the same virion for the virus to be infectious, as demonstrated by brome mosaic virus and several other plant viruses."
BIO,"A viral genome, irrespective of nucleic acid type, is almost always either single-stranded (ss) or double-stranded (ds)."
BIO,"Single-stranded genomes consist of an unpaired nucleic acid, analogous to one-half of a ladder split down the middle."
BIO,"Double-stranded genomes consist of two complementary paired nucleic acids, analogous to a ladder."
BIO,"The virus particles of some virus families, such as those belonging to the Hepadnaviridae, contain a genome that is partially double-stranded and partially single-stranded."
BIO,"For most viruses with RNA genomes and some with single-stranded DNA (ssDNA) genomes, the single strands are said to be either positive-sense (called the 'plus-strand') or negative-sense (called the 'minus-strand'), depending on if they are complementary to the viral messenger RNA (mRNA)."
BIO,"Positive-sense viral RNA is in the same sense as viral mRNA and thus at least a part of it can be immediately translated by the host cell."
BIO,"Negative-sense viral RNA is complementary to mRNA and thus must be converted to positive-sense RNA by an RNA-dependent RNA polymerase before translation."
BIO,"DNA nomenclature for viruses with genomic ssDNA is similar to RNA nomenclature, in that positive-strand viral ssDNA is identical in sequence to the viral mRNA and is thus a coding strand, while negative-sense viral ssDNA is complementary to the viral mRNA and is thus a template strand."
BIO,"Several types of ssDNA and ssRNA viruses have genomes that are ambisense in that transcription can occur off both strands in a double-stranded replicative intermediate."
BIO,"Examples include geminiviruses, which are ssDNA plant viruses and arenaviruses, which are ssRNA viruses of animals."
BIO,"Genome size varies greatly between species."
BIO,"The smallest—the ssDNA circoviruses, family Circoviridae—code for only two proteins and have a genome size of only two kilobases; the largest—the pandoraviruses—have genome sizes of around two megabases which code for about 2500 proteins."
BIO,"Virus genes rarely have introns and often are arranged in the genome so that they overlap."
BIO,"In general, RNA viruses have smaller genome sizes than DNA viruses because of a higher error-rate when replicating, and have a maximum upper size limit."
BIO,"Beyond this, errors when replicating render the virus useless or uncompetitive."
BIO,"To compensate, RNA viruses often have segmented genomes—the genome is split into smaller molecules—thus reducing the chance that an error in a single-component genome will incapacitate the entire genome."
BIO,"In contrast, DNA viruses generally have larger genomes because of the high fidelity of their replication enzymes."
BIO,"Single-strand DNA viruses are an exception to this rule, as mutation rates for these genomes can approach the extreme of the ssRNA virus case."
BIO,"Viruses undergo genetic change by several mechanisms."
BIO,"These include a process called antigenic drift where individual bases in the DNA or RNA mutate to other bases."
BIO,"Most of these point mutations are "silent"—they do not change the protein that the gene encodes—but others can confer evolutionary advantages such as resistance to antiviral drugs."
BIO,"Antigenic shift occurs when there is a major change in the genome of the virus."
BIO,"This can be a result of recombination or reassortment."
BIO,"When this happens with influenza viruses, pandemics might result."
BIO,"RNA viruses often exist as quasispecies or swarms of viruses of the same species but with slightly different genome nucleoside sequences."
BIO,"Such quasispecies are a prime target for natural selection."
BIO,"Segmented genomes confer evolutionary advantages; different strains of a virus with a segmented genome can shuffle and combine genes and produce progeny viruses (or offspring) that have unique characteristics."
BIO,"This is called reassortment or 'viral sex'."
BIO,"Genetic recombination is a process by which a strand of DNA (or RNA) is broken and then joined to the end of a different DNA (or RNA) molecule."
BIO,"This can occur when viruses infect cells simultaneously and studies of viral evolution have shown that recombination has been rampant in the species studied."
BIO,"Recombination is common to both RNA and DNA viruses."
BIO,"Coronaviruses have a single-strand positive-sense RNA genome."
BIO,"Replication of the genome is catalyzed by an RNA-dependent RNA polymerase."
BIO,"The mechanism of recombination used by coronaviruses likely involves template switching by the polymerase during genome replication."
BIO,"This process appears to be an adaptation for coping with genome damage."
BIO,"Viral populations do not grow through cell division, because they are acellular."
BIO,"Instead, they use the machinery and metabolism of a host cell to produce multiple copies of themselves, and they assemble in the cell."
BIO,"When infected, the host cell is forced to rapidly produce thousands of copies of the original virus."
BIO,"Their life cycle differs greatly between species, but there are six basic stages in their life cycle:"
BIO,"Attachment is a specific binding between viral capsid proteins and specific receptors on the host cellular surface."
BIO,"This specificity determines the host range and type of host cell of a virus."
BIO,"For example, HIV infects a limited range of human leucocytes."
BIO,"This is because its surface protein, gp120, specifically interacts with the CD4 molecule—a chemokine receptor—which is most commonly found on the surface of CD4+ T-Cells."
