BIO,"A virus is a tiny infectious agent that reproduces inside the cells of living hosts."
BIO,"When infected, the host cell is forced to rapidly produce thousands of identical copies of the original virus."
BIO,"Unlike most living things, viruses do not have cells that divide; new viruses assemble in the infected host cell."
BIO,"But unlike simpler infectious agents like prions, they contain genes, which allow them to mutate and evolve."
BIO,"Over 4,800 species of viruses have been described in detail out of the millions in the environment."
BIO,"Their origin is unclear: some may have evolved from plasmids—pieces of DNA that can move between cells—while others may have evolved from bacteria."
BIO,"Viruses are made of either two or three parts."
BIO,"All include genes."
BIO,"These genes contain the encoded biological information of the virus and are built from either DNA or RNA."
BIO,"All viruses are also covered with a protein coat to protect the genes."
BIO,"Some viruses may also have an envelope of fat-like substance that covers the protein coat, and makes them vulnerable to soap."
BIO,"A virus with this "viral envelope" uses it—along with specific receptors—to enter a new host cell."
BIO,"Viruses vary in shape from the simple helical and icosahedral to more complex structures."
BIO,"Viruses range in size from 20 to 300 nanometres; it would take 33,000 to 500,000 of them, side by side, to stretch to 1 centimetre (0.4 in)."
BIO,"Viruses spread in many ways."
BIO,"Although many are very specific about which host species or tissue they attack, each species of virus relies on a particular method to copy itself."
BIO,"Plant viruses are often spread from plant to plant by insects and other organisms, known as vectors."
BIO,"Some viruses of humans and other animals are spread by exposure to infected bodily fluids."
BIO,"Viruses such as influenza are spread through the air by droplets of moisture when people cough or sneeze."
BIO,"Viruses such as norovirus are transmitted by the faecal–oral route, which involves the contamination of hands, food and water."
BIO,"Rotavirus is often spread by direct contact with infected children."
BIO,"The human immunodeficiency virus, HIV, is transmitted by bodily fluids transferred during sex."
BIO,"Others, such as the dengue virus, are spread by blood-sucking insects."
BIO,"Viruses, especially those made of RNA, can mutate rapidly to give rise to new types."
BIO,"Hosts may have little protection against such new forms."
BIO,"Influenza virus, for example, changes often, so a new vaccine is needed each year."
BIO,"Major changes can cause pandemics, as in the 2009 swine influenza that spread to most countries."
BIO,"Often, these mutations take place when the virus has first infected other animal hosts."
BIO,"Some examples of such "zoonotic" diseases include coronavirus in bats, and influenza in pigs and birds, before those viruses were transferred to humans."
BIO,"Viral infections can cause disease in humans, animals and plants."
BIO,"In healthy humans and animals, infections are usually eliminated by the immune system, which can provide lifetime immunity to the host for that virus."
BIO,"Antibiotics, which work against bacteria, have no impact, but antiviral drugs can treat life-threatening infections."
BIO,"Those vaccines that produce lifelong immunity can prevent some infections."
BIO,"In 1884, French microbiologist Charles Chamberland invented the Chamberland filter (or Chamberland–Pasteur filter), that contains pores smaller than bacteria."
BIO,"He could then pass a solution containing bacteria through the filter, and completely remove them."
BIO,"In the early 1890s, Russian biologist Dmitri Ivanovsky used this method to study what became known as the tobacco mosaic virus."
BIO,"His experiments showed that extracts from the crushed leaves of infected tobacco plants remain infectious after filtration."
BIO,"At the same time, several other scientists showed that, although these agents (later called viruses) were different from bacteria and about one hundred times smaller, they could still cause disease."
BIO,"In 1899, Dutch microbiologist Martinus Beijerinck observed that the agent only multiplied when in dividing cells."
BIO,"He called it a "contagious living fluid" (Latin: contagium vivum fluidum)—or a "soluble living germ" because he could not find any germ-like particles."
BIO,"In the early 20th century, English bacteriologist Frederick Twort discovered viruses that infect bacteria, and French-Canadian microbiologist Félix d'Herelle described viruses that, when added to bacteria growing on agar, would lead to the formation of whole areas of dead bacteria."
BIO,"Counting these dead areas allowed him to calculate the number of viruses in the suspension."
BIO,"The invention of the electron microscope in 1931 brought the first images of viruses."
BIO,"In 1935, American biochemist and virologist Wendell Meredith Stanley examined the tobacco mosaic virus (TMV) and found it to be mainly made from protein."
BIO,"A short time later, this virus was shown to be made from protein and RNA."
BIO,"Rosalind Franklin developed X-ray crystallographic pictures and determined the full structure of TMV in 1955."
BIO,"Franklin confirmed that viral proteins formed a spiral hollow tube, wrapped by RNA, and also showed that viral RNA was a single strand, not a double helix like DNA."
BIO,"A problem for early scientists was that they did not know how to grow viruses without using live animals."
BIO,"The breakthrough came in 1931, when American pathologists Ernest William Goodpasture and Alice Miles Woodruff grew influenza, and several other viruses, in fertilised chickens' eggs."
BIO,"Some viruses could not be grown in chickens' eggs."
BIO,"This problem was solved in 1949, when John Franklin Enders, Thomas Huckle Weller, and Frederick Chapman Robbins grew polio virus in cultures of living animal cells."
BIO,"Over 4,800 species of viruses have been described in detail."
BIO,"Viruses co-exist with life wherever it occurs."
BIO,"They have probably existed since living cells first evolved."
BIO,"Their origin remains unclear because they do not fossilize, so molecular techniques have been the best way to hypothesise about how they arose."
BIO,"These techniques rely on the availability of ancient viral DNA or RNA, but most viruses that have been preserved and stored in laboratories are less than 90 years old."
BIO,"Molecular methods have only been successful in tracing the ancestry of viruses that evolved in the 20th century."
BIO,"New groups of viruses might have repeatedly emerged at all stages of the evolution of life."
BIO,"There are three major theories about the origins of viruses:"
BIO,"Viruses may have once been small cells that parasitised larger cells."
BIO,"Eventually, the genes they no longer needed for a parasitic way of life were lost."
BIO,"The bacteria Rickettsia and Chlamydia are living cells that, like viruses, can reproduce only inside host cells."
BIO,"This lends credence to this theory, as their dependence on being parasites may have led to the loss of the genes that once allowed them to live on their own."
BIO,"Some viruses may have evolved from bits of DNA or RNA that "escaped" from the genes of a larger organism."
BIO,"The escaped DNA could have come from plasmids—pieces of DNA that can move between cells—while others may have evolved from bacteria."
BIO,"Viruses may have evolved from complex molecules of protein and DNA at the same time as cells first appeared on earth, and would have depended on cellular life for many millions of years."
BIO,"There are problems with all of these theories."
BIO,"The regressive hypothesis does not explain why even the smallest of cellular parasites do not resemble viruses in any way."
BIO,"The escape or the cellular origin hypothesis does not explain the presence of unique structures in viruses that do not appear in cells."
BIO,"The coevolution, or "virus-first" hypothesis, conflicts with the definition of viruses, because viruses depend on host cells."
BIO,"Also, viruses are recognised as ancient, and to have origins that pre-date the divergence of life into the three domains."
BIO,"This discovery has led modern virologists to reconsider and re-evaluate these three classical hypotheses."
BIO,"A virus particle, also called a virion, consists of genes made from DNA or RNA which are surrounded by a protective coat of protein called a capsid."
BIO,"The capsid is made of many smaller, identical protein molecules called capsomers."
BIO,"The arrangement of the capsomers can either be icosahedral (20-sided), helical, or more complex."
BIO,"There is an inner shell around the DNA or RNA called the nucleocapsid, made out of proteins."
BIO,"Some viruses are surrounded by a bubble of lipid (fat) called an envelope, which makes them vulnerable to soap and alcohol."
BIO,"Viruses are among the smallest infectious agents, and are too small to be seen by light microscopy; most of them can only be seen by electron microscopy."
BIO,"Their sizes range from 20 to 300 nanometres; it would take 30,000 to 500,000 of them, side by side, to stretch to one centimetre (0.4 in)."
BIO,"In comparison, bacteria are typically around 1000 nanometres (1 micrometer) in diameter, and host cells of higher organisms are typically a few tens of micrometers."
BIO,"Some viruses such as megaviruses and pandoraviruses are relatively large viruses."
BIO,"At around 1000 nanometres, these viruses, which infect amoebae, were discovered in 2003 and 2013."
BIO,"They are around ten times wider (and thus a thousand times larger in volume) than influenza viruses, and the discovery of these "giant" viruses astonished scientists."
BIO,"The genes of viruses are made from DNA (deoxyribonucleic acid) and, in many viruses, RNA (ribonucleic acid)."
BIO,"The biological information contained in an organism is encoded in its DNA or RNA."
BIO,"Most organisms use DNA, but many viruses have RNA as their genetic material."
BIO,"The DNA or RNA of viruses consists of either a single strand or a double helix."
BIO,"Viruses can reproduce rapidly because they have relatively few genes."
BIO,"For example, influenza virus has only eight genes and rotavirus has eleven."
BIO,"In comparison, humans have 20,000–25,000."
BIO,"Some viral genes contain the code to make the structural proteins that form the virus particle."
BIO,"Other genes make non-structural proteins found only in the cells the virus infects."
BIO,"All cells, and many viruses, produce proteins that are enzymes that drive chemical reactions."
BIO,"Some of these enzymes, called DNA polymerase and RNA polymerase, make new copies of DNA and RNA."
BIO,"A virus's polymerase enzymes are often much more efficient at making DNA and RNA than the equivalent enzymes of the host cells, but viral RNA polymerase enzymes are error-prone, causing RNA viruses to mutate and form new strains."
BIO,"In some species of RNA virus, the genes are not on a continuous molecule of RNA, but are separated."
BIO,"The influenza virus, for example, has eight separate genes made of RNA."
BIO,"When two different strains of influenza virus infect the same cell, these genes can mix and produce new strains of the virus in a process called reassortment."
BIO,"Proteins are essential to life."
BIO,"Cells produce new protein molecules from amino acid building blocks based on information coded in DNA."
BIO,"Each type of protein is a specialist that usually only performs one function, so if a cell needs to do something new, it must make a new protein."
BIO,"Viruses force the cell to make new proteins that the cell does not need, but are needed for the virus to reproduce."
BIO,"Protein synthesis consists of two major steps: transcription and translation."
BIO,"Transcription is the process where information in DNA, called the genetic code, is used to produce RNA copies called messenger RNA (mRNA)."
BIO,"These migrate through the cell and carry the code to ribosomes where it is used to make proteins."
BIO,"This is called translation because the protein's amino acid structure is determined by the mRNA's code."
BIO,"Information is hence translated from the language of nucleic acids to the language of amino acids."
BIO,"Some nucleic acids of RNA viruses function directly as mRNA without further modification."
BIO,"For this reason, these viruses are called positive-sense RNA viruses."
BIO,"In other RNA viruses, the RNA is a complementary copy of mRNA and these viruses rely on the cell's or their own enzyme to make mRNA."
BIO,"These are called negative-sense RNA viruses."
BIO,"In viruses made from DNA, the method of mRNA production is similar to that of the cell."
BIO,"The species of viruses called retroviruses behave completely differently: they have RNA, but inside the host cell a DNA copy of their RNA is made with the help of the enzyme reverse transcriptase."
BIO,"This DNA is then incorporated into the host's own DNA, and copied into mRNA by the cell's normal pathways."
BIO,"When a virus infects a cell, the virus forces it to make thousands more viruses."
BIO,"It does this by making the cell copy the virus's DNA or RNA, making viral proteins, which all assemble to form new virus particles."
BIO,"There are six basic, overlapping stages in the life cycle of viruses in living cells:"
BIO,"Attachment is the binding of the virus to specific molecules on the surface of the cell."
BIO,"This specificity restricts the virus to a very limited type of cell."
BIO,"For example, the human immunodeficiency virus (HIV) infects only human T cells, because its surface protein, gp120, can only react with CD4 and other molecules on the T cell's surface."
BIO,"Plant viruses can only attach to plant cells and cannot infect animals."
BIO,"This mechanism has evolved to favour those viruses that only infect cells in which they are capable of reproducing."
BIO,"Penetration follows attachment; viruses penetrate the host cell by endocytosis or by fusion with the cell."
BIO,"Uncoating happens inside the cell when the viral capsid is removed and destroyed by viral enzymes or host enzymes, thereby exposing the viral nucleic acid."
BIO,"Replication of virus particles is the stage where a cell uses viral messenger RNA in its protein synthesis systems to produce viral proteins."
BIO,"The RNA or DNA synthesis abilities of the cell produce the virus's DNA or RNA."
BIO,"Assembly takes place in the cell when the newly created viral proteins and nucleic acid combine to form hundreds of new virus particles."
BIO,"Release occurs when the new viruses escape or are released from the cell."
BIO,"Most viruses achieve this by making the cells burst, a process called lysis."
BIO,"Other viruses such as HIV are released more gently by a process called budding."
BIO,"Viruses have an extensive range of structural and biochemical effects on the host cell.These are called cytopathic effects."
BIO,"Most virus infections eventually result in the death of the host cell."
BIO,"The causes of death include cell lysis (bursting), alterations to the cell's surface membrane and apoptosis (cell "suicide")."
BIO,"Often cell death is caused by cessation of its normal activity due to proteins produced by the virus, not all of which are components of the virus particle."
BIO,"Some viruses cause no apparent changes to the infected cell."
BIO,"Cells in which the virus is latent (inactive) show few signs of infection and often function normally."
BIO,"This causes persistent infections and the virus is often dormant for many months or years."
BIO,"This is often the case with herpes viruses."
BIO,"Some viruses, such as Epstein–Barr virus, often cause cells to proliferate without causing malignancy; but some other viruses, such as papillomavirus, are an established cause of cancer."
BIO,"When a cell's DNA is damaged by a virus such that the cell cannot repair itself, this often triggers apoptosis."
BIO,"One of the results of apoptosis is destruction of the damaged DNA by the cell itself."
BIO,"Some viruses have mechanisms to limit apoptosis so that the host cell does not die before progeny viruses have been produced; HIV, for example, does this."
BIO,"There are many ways in which viruses spread from host to host but each species of virus uses only one or two."
BIO,"Many viruses that infect plants are carried by organisms; such organisms are called vectors."
BIO,"Some viruses that infect animals, including humans, are also spread by vectors, usually blood-sucking insects, but direct transmission is more common."
BIO,"Some virus infections, such as norovirus and rotavirus, are spread by contaminated food and water, by hands and communal objects, and by intimate contact with another infected person, while others like SARS-CoV-2 and influenza viruses are airborne."
BIO,"Viruses such as HIV, hepatitis B and hepatitis C are often transmitted by unprotected sex or contaminated hypodermic needles."
BIO,"To prevent infections and epidemics, it is important to know how each different kind of virus is spread."
BIO,"Common human diseases caused by viruses include the common cold, influenza, chickenpox and cold sores."
BIO,"Serious diseases such as Ebola and AIDS are also caused by viruses."
BIO,"Many viruses cause little or no disease and are said to be "benign"."
BIO,"The more harmful viruses are described as virulent."
BIO,"Viruses cause different diseases depending on the types of cell that they infect."
BIO,"Some viruses can cause lifelong or chronic infections where the viruses continue to reproduce in the body despite the host's defence mechanisms."
BIO,"This is common in hepatitis B virus and hepatitis C virus infections."
BIO,"People chronically infected with a virus are known as carriers."
BIO,"They serve as important reservoirs of the virus."
BIO,"If the proportion of carriers in a given population reaches a given threshold, a disease is said to be endemic."
BIO,"Before the advent of vaccination, infections with viruses were common and outbreaks occurred regularly."
BIO,"In countries with a temperate climate, viral diseases are usually seasonal."
BIO,"Poliomyelitis, caused by poliovirus often occurred in the summer months."
BIO,"By contrast colds, influenza and rotavirus infections are usually a problem during the winter months."
BIO,"Other viruses, such as measles virus, caused outbreaks regularly every third year."
BIO,"In developing countries, viruses that cause respiratory and enteric infections are common throughout the year."
BIO,"Viruses carried by insects are a common cause of diseases in these settings."
BIO,"Zika and dengue viruses for example are transmitted by the female Aedes mosquitoes, which bite humans particularly during the mosquitoes' breeding season."
BIO,"Although viral pandemics are rare events, HIV—which evolved from viruses found in monkeys and chimpanzees—has been pandemic since at least the 1980s."
BIO,"During the 20th century there were four pandemics caused by influenza virus and those that occurred in 1918, 1957 and 1968 were severe."
BIO,"Before its eradication, smallpox was a cause of pandemics for more than 3,000 years."
BIO,"Throughout history, human migration has aided the spread of pandemic infections; first by sea and in modern times also by air."
BIO,"With the exception of smallpox, most pandemics are caused by newly evolved viruses."
BIO,"These "emergent" viruses are usually mutants of less harmful viruses that have circulated previously either in humans or in other animals."
BIO,"Severe acute respiratory syndrome (SARS) and Middle East respiratory syndrome (MERS) are caused by new types of coronaviruses."
BIO,"Other coronaviruses are known to cause mild infections in humans, so the virulence and rapid spread of SARS infections—that by July 2003 had caused around 8,000 cases and 800 deaths—was unexpected and most countries were not prepared."
BIO,"A related coronavirus emerged in Wuhan, China, in November 2019 and spread rapidly around the world."
BIO,"Thought to have originated in bats and subsequently named severe acute respiratory syndrome coronavirus 2, infections with the virus cause a disease called COVID-19, that varies in severity from mild to deadly, and led to a pandemic in 2020."
BIO,"Restrictions unprecedented in peacetime were placed on international travel, and curfews imposed in several major cities worldwide."
BIO,"There are many types of plant virus, but often they only cause a decrease in yield, and it is not economically viable to try to control them."
BIO,"Plant viruses are frequently spread from plant to plant by organisms called "vectors"."
BIO,"These are normally insects, but some fungi, nematode worms and single-celled organisms have also been shown to be vectors."
BIO,"When control of plant virus infections is considered economical (perennial fruits, for example) efforts are concentrated on killing the vectors and removing alternate hosts such as weeds."
BIO,"Plant viruses are harmless to humans and other animals because they can only reproduce in living plant cells."
BIO,"Bacteriophages are viruses that infect bacteria and archaea."
BIO,"They are important in marine ecology: as the infected bacteria burst, carbon compounds are released back into the environment, which stimulates fresh organic growth."
BIO,"Bacteriophages are useful in scientific research because they are harmless to humans and can be studied easily."
BIO,"These viruses can be a problem in industries that produce food and drugs by fermentation and depend on healthy bacteria."
BIO,"Some bacterial infections are becoming difficult to control with antibiotics, so there is a growing interest in the use of bacteriophages to treat infections in humans."
BIO,"Animals, including humans, have many natural defences against viruses."
BIO,"Some are non-specific and protect against many viruses regardless of the type."
BIO,"This innate immunity is not improved by repeated exposure to viruses and does not retain a "memory" of the infection."
BIO,"The skin of animals, particularly its surface, which is made from dead cells, prevents many types of viruses from infecting the host."
BIO,"The acidity of the contents of the stomach destroys many viruses that have been swallowed."
BIO,"When a virus overcomes these barriers and enters the host, other innate defences prevent the spread of infection in the body."
BIO,"A special hormone called interferon is produced by the body when viruses are present, and this stops the viruses from reproducing by killing the infected cells and their close neighbours."
BIO,"Inside cells, there are enzymes that destroy the RNA of viruses."
BIO,"This is called RNA interference."
BIO,"Some blood cells engulf and destroy other virus-infected cells."
BIO,"Specific immunity to viruses develops over time and white blood cells called lymphocytes play a central role."
BIO,"Lymphocytes retain a "memory" of virus infections and produce many special molecules called antibodies."
BIO,"These antibodies attach to viruses and stop the virus from infecting cells."
BIO,"Antibodies are highly selective and attack only one type of virus."
BIO,"The body makes many different antibodies, especially during the initial infection."
BIO,"After the infection subsides, some antibodies remain and continue to be produced, usually giving the host lifelong immunity to the virus."
BIO,"Plants have elaborate and effective defence mechanisms against viruses."
BIO,"One of the most effective is the presence of so-called resistance (R) genes."
BIO,"Each R gene confers resistance to a particular virus by triggering localised areas of cell death around the infected cell, which can often be seen with the unaided eye as large spots."
BIO,"This stops the infection from spreading."
BIO,"RNA interference is also an effective defence in plants."
BIO,"When they are infected, plants often produce natural disinfectants that destroy viruses, such as salicylic acid, nitric oxide and reactive oxygen molecules."
BIO,"The major way bacteria defend themselves from bacteriophages is by producing enzymes which destroy foreign DNA."
BIO,"These enzymes, called restriction endonucleases, cut up the viral DNA that bacteriophages inject into bacterial cells."
BIO,"Vaccines simulate a natural infection and its associated immune response, but do not cause the disease."
BIO,"Their use has resulted in the eradication of smallpox and a dramatic decline in illness and death caused by infections such as polio, measles, mumps and rubella."
BIO,"Vaccines are available to prevent over fourteen viral infections of humans and more are used to prevent viral infections of animals."
BIO,"Vaccines may consist of either live or killed viruses."
BIO,"Live vaccines contain weakened forms of the virus, but these vaccines can be dangerous when given to people with weak immunity."
BIO,"In these people, the weakened virus can cause the original disease."
BIO,"Biotechnology and genetic engineering techniques are used to produce "designer" vaccines that only have the capsid proteins of the virus."
BIO,"Hepatitis B vaccine is an example of this type of vaccine."
BIO,"These vaccines are safer because they can never cause the disease."
BIO,"Since the mid-1980s, the development of antiviral drugs has increased rapidly, mainly driven by the AIDS pandemic."
BIO,"Antiviral drugs are often nucleoside analogues, which masquerade as DNA building blocks (nucleosides)."
BIO,"When the replication of virus DNA begins, some of the fake building blocks are used."
BIO,"This prevents DNA replication because the drugs lack the essential features that allow the formation of a DNA chain."
BIO,"When DNA production stops the virus can no longer reproduce."
BIO,"Examples of nucleoside analogues are aciclovir for herpes virus infections and lamivudine for HIV and hepatitis B virus infections."
BIO,"Aciclovir is one of the oldest and most frequently prescribed antiviral drugs."
